Location_name,Literature,Cultural_Significance,Distinctive_Feature,Latitude,Longitude,Google_Maps_Link,Official_Website,Category
Bideford - The Last Witches of England,"The Witches of Warboys (various)
Witch Hunt (various accounts)","On 25 August 1682, Temperance Lloyd, Susanna Edwards and Mary Trembles were hanged at Heavitree Gallows in Exeter after being convicted of witchcraft in Bideford. They were the last people to be executed for witchcraft in England. The accusations began in Bideford where the women lived, and their trial drew enormous public attention. Their story remains one of the most significant and tragic episodes in English legal history.","A historic port town on the River Torridge where the witchcraft accusations originated. A plaque in the town commemorates the three women. The Bideford courthouse where they were first examined still stands.",51.0167,-4.2083,https://maps.app.goo.gl/bideford,,Horrible History
Dartmoor Prison - Napoleonic Hell,"The Hound of the Baskervilles (Arthur Conan Doyle, 1902)
Prisoner of War (various accounts)","Dartmoor Prison opened in 1809 to house thousands of French Napoleonic prisoners of war, followed by American prisoners from the War of 1812. Conditions were brutal — prisoners were so hungry they reportedly ate rats, grass and earthworms. On 6 April 1815 British guards fired on American prisoners in what became known as the Dartmoor Massacre, killing seven and wounding many more. The prison later held some of Britain's most dangerous criminals including Frank Mitchell, the Mad Axeman, who escaped and was later murdered by the Kray Brothers.","A forbidding granite prison on the open moorland of Dartmoor, still operational today. The Dartmoor Prison Museum houses manacles, straightjackets, escape stories and weapons made by prisoners across two centuries of incarceration.",50.5497,-3.9961,https://maps.app.goo.gl/dartmoor,https://www.dartmoor-prison.co.uk/,Horrible History
Heavitree Gallows - Exeter,"The Witchfinder General (Ronald Bassett, 1966)","Heavitree Gallows was Devon's principal place of execution for centuries, located on the eastern edge of Exeter. Hundreds were hanged here including murderers, thieves and highway robbers. Women convicted of poisoning their husbands were burned at the stake. In 1682 the Bideford Witches — the last people executed for witchcraft in England — were hanged here. The last execution at Heavitree was Joan Stone in 1794, a 17-year-old girl hanged for setting fire to her master's house. Executions then moved to the newly built Exeter Prison.","A residential area of Exeter where the gallows once stood. Gallows Cross marks the historic execution site. The area's grim history is largely unmarked but the street names and local records preserve the memory of its dark past.",50.7184,-3.4956,https://maps.app.goo.gl/heavitree,,Horrible History
Exeter Prison - The Man They Could Not Hang,"The Man They Could Not Hang (various accounts)
Babbacombe Lee (Fairport Convention, 1971)","On 23 February 1885, John 'Babbacombe' Lee stood on the gallows at Exeter Prison three times. Three times the trapdoor failed to open. His execution was halted and his death sentence commuted to life imprisonment. Lee had been convicted of the murder of his employer Emma Keyse at Babbacombe, Torquay. He served 22 years and was released in 1907. His story became the subject of a Fairport Convention concept album and remains one of the strangest and most haunting episodes in British criminal history.","Exeter Prison stands on New North Road in the city centre, a forbidding Victorian jail still in operation today. The execution chamber where the gallows failed three times is no longer accessible but the building itself looms over the street.",50.7293,-3.5275,https://maps.app.goo.gl/exeterprison,https://www.exetermemories.co.uk/,Horrible History
Babbacombe - Scene of the Unsolved Murder,"Babbacombe Lee (Fairport Convention, 1971)","On the night of 14 November 1884, Miss Emma Keyse was found murdered at The Glen, her cottage at Babbacombe beach near Torquay. Her servant John Lee was convicted and sentenced to hang — but the gallows failed three times. Whether Lee was truly guilty has never been established with certainty. The case remains one of Devon's most debated Victorian crimes. Babbacombe beach itself is unchanged — a small, sheltered cove reached by a cliff railway, its peaceful appearance belying its notorious history.","A beautiful sheltered beach reached by the famous Babbacombe Cliff Railway. The atmosphere of the Victorian seaside resort is largely intact. The site of The Glen cottage where the murder took place is nearby.",50.4833,-3.5000,https://maps.app.goo.gl/babbacombe,https://www.babbacombecliff.co.uk/,Horrible History
